{
    "$schema": "http://json-schema.org/draft-07/schema",

    "title": "ACS (Split)",
    "description": "Monika After Story Mod split ACS JSON schema",

    "type": "object",
    "additionalProperties": false,

    "if": {
        "anyOf": [
            { "properties": { "rec_layer": { "const": 8 } } },
            { "properties": { "rec_layer": { "const": 9 } } }
        ]
    },
    "then": {
        "required": [
            "version",
            "type",
            "name",
            "img_sit",
            "pose_map",
            "arm_split"
        ]
    },
    "else": {
        "required": [
            "version",
            "type",
            "name",
            "img_sit",
            "pose_map"
        ]
    },

    "properties": {
        "__author": { "$ref": "#/$defs/any" },

        "version": { "const": 3 },
        "type":    { "const": 0 },
        "name":    { "type": "string" },
        "img_sit": { "$ref": "#/$defs/filename" },

        "pose_map": {
            "type": "object",
            "additionalProperties": false,
            "properties": {
                "mpm_type":      { "type": "integer" },
                "default":       { "$ref": "#/$defs/pose" },
                "l_default":     { "$ref": "#/$defs/pose" },
                "use_reg_for_l": { "type": "boolean", "default": false }
            },
            "patternProperties": {
                "p[0-7]": { "$ref": "#/$defs/pose" }
            }
        },

        "arm_split": {
            "type": "object",
            "additionalProperties": false,
            "properties": {
                "mpm_type":      { "type": "integer" },
                "default":       { "$ref": "#/$defs/acs_split_pose" },
                "l_default":     { "$ref": "#/$defs/acs_split_pose" },
                "use_reg_for_l": { "type": "boolean", "default": false }
            },
            "patternProperties": {
                "p[0-7]": { "$ref": "#/$defs/acs_split_pose" }
            }
        },

        "stay_on_start": { "type": "boolean", "default": false },

        "ex_props": {
            "type": "object",
            "default": { },
            "properties": {
                "drink":               { "$ref": "#/$defs/flag" },
                "excluded-hair-props": { "$ref": "#/$defs/string_list" },
                "food":                { "$ref": "#/$defs/flag" },
                "left-desk-acs":       { "$ref": "#/$defs/flag" },
                "required-hair-prop":  { "type": "string" },
                "ribbon-like":         { "$ref": "#/$defs/flag" },
                "twin-ribbon":         { "$ref": "#/$defs/flag" }
            }
        },

        "select_info": {
            "type": "object",
            "additionalProperties": false,
            "properties": {
                "display_name":        { "type": "string" },
                "thumb":               { "$ref": "#/$defs/filename" },
                "group":               { "type": "string" },
                "visible_when_locked": { "type": "boolean", "default": true },
                "select_dlg":          { "$ref": "#/$defs/string_list" }
            }
        },

        "highlight": {
            "type": "object",
            "additionalProperties": false,

            "properties": {
                "default": { "$ref": "#/$defs/filter" },
                "mapping": {
                    "type": "object",
                    "additionalProperties": false,
                    "patternProperties": { "^.*$": { "$ref": "#/$defs/filter" } }
                }
            }
        },

        "dryrun":       { "$ref": "#/$defs/flag" },
        "rec_layer":    { "enum": [ 0, 1, 2, 3, 4, 5, 6, 7, 8, 9, 10, 11 ], "default": 2 },
        "priority":     { "type": "integer", "default": 10 },
        "acs_type":     { "type": "string", "default": null },
        "mux_type":     { "$ref": "#/$defs/string_list" },
        "giftname":     { "$ref": "#/$defs/filename" },
        "dlg_desc":     { "type": "string", "pattern": "^[^A-Z]*$" },
        "dlg_plural":   { "type": "boolean" },
        "keep_on_desk": { "type": "boolean", "default": false }
    },

    "$defs": {
        "pose": { "type": "string", "default": null },
        "acs_split_pose": {
            "type": "string", "pattern": "^(?:|\\*|(?:(?:0|1|5|10))(?:\\^(?:0|1|5|10))*)$", "default": null
        },

        "flag": { },

        "string_list": { "type": "array","items": { "type": "string" }, "default": null },

        "filter":  {
            "type": "object",
            "properties": {
                "default": { "type": "string" },
                "day":     { "type": "string" },
                "night":   { "type": "string" }
            }
        },

        "filename": { "type": "string", "pattern": "^[^./\\\\]*$" },

        "any": { "type": [ "number", "string", "boolean", "object", "array", "null" ] }
    }
}
