{
    "__author": "briaryoung",
    "version": 3,
    "type": 0,
    "name": "briaryoung_mini_ribbon_pink",
    "img_sit": "briaryoung_mini_ribbon_pink",
    "pose_map": {
        "default": "0",
        "l_default": "5"
    },
    "rec_layer": 3,
    "acs_type": "mini-ribbon",
    "stay_on_start": true,
    "dlg_desc": "pink ribbon",
    "dlg_plural": false,
    "select_info": {
        "display_name": "Ribbon (Pink, mini)",
        "thumb": "briaryoung_mini_ribbon_pink",
        "group": "ribbon",
        "select_dlg": [
            "Cute!"
        ]
    },
    "giftname": "minipinkribbon"
}
