{
    "__author": "briaryoung",
    "version": 3,
    "type": 0,
    "name": "briaryoung_mini_ribbon_royal_blue",
    "img_sit": "briaryoung_mini_ribbon_royal_blue",
    "pose_map": {
        "default": "0",
        "l_default": "5"
    },
    "rec_layer": 3,
    "acs_type": "mini-ribbon",
    "stay_on_start": true,
    "dlg_desc": "royal blue ribbon",
    "dlg_plural": false,
    "select_info": {
        "display_name": "Ribbon (Royal blue, mini)",
        "thumb": "briaryoung_mini_ribbon_royal_blue",
        "group": "ribbon",
        "select_dlg": [
            "Blue is always a good choice!"
        ]
    },
    "giftname": "miniroyalblueribbon"
}
