{
    "__author": "Briar Young",
    "version": 3,
    "type": 0,
    "name": "briaryoung_choker_spiral_black",
    "img_sit": "briaryoung_choker_spiral_black",
    "pose_map": {
        "default": "0",
        "l_default": "5"
    },
    "rec_layer": 8,
    "acs_type": "choker",
    "stay_on_start": true,
    "priority": 8,
    "dlg_desc": "choker",
    "dlg_plural": false,
    "select_info": {
        "display_name": "Choker (Spiral, Black)",
        "thumb": "briaryoung_choker_spiral_black",
        "group": "choker"
    },
    "giftname": "chokerspiralblack",
    "arm_split": {
        "default": "0",
        "use_reg_for_l": true
    }
}
