{
    "__author": "HistoryVariety",
    "version": 3,
    "type": 0,
    "name": "historyvariety_triforce_necklace",
    "img_sit": "historyvariety_triforce_necklace",
    "pose_map": {
        "default": "0",
        "l_default": "5"
    },
    "rec_layer": 8,
    "acs_type": "necklace",
    "stay_on_start": true,
    "priority": 8,
    "dlg_desc": "necklace",
    "dlg_plural": false,
    "select_info": {
        "display_name": "Triforce Necklace",
        "thumb": "historyvariety_triforce_necklace",
        "group": "necklace",
        "select_dlg": [
            "It's dangerous to go alone, take this!"
        ]
    },
    "giftname": "triforce_necklace",
    "arm_split": {
        "default": "0",
        "use_reg_for_l": true
    }
}
