{
    "__author": "Velius94",
    "version": 3,
    "type": 0,
    "name": "velius94_ribbon_silver",
    "img_sit": "velius94_ribbon_silver",
    "pose_map": {
        "default": "0",
        "l_default": "5"
    },
    "rec_layer": 3,
    "acs_type": "s-type-ribbon",
    "stay_on_start": true,
    "select_info": {
        "display_name": "Ribbon (Silver, s-type)",
        "thumb": "velius94_ribbon_silver",
        "group": "ribbon",
        "select_dlg": [
            "Nice choice, [player]."
        ]
    },
    "giftname": "stypesilverribbon"
}
