{
    "__author": "anonymioo",
    "version": 3,
    "type": 0,
    "name": "anonymioo_ribbon_transexualpride",
    "img_sit": "anonymioo_ribbon_transexualpride",
    "pose_map": {
        "default": "0",
        "l_default": "5"
    },
    "rec_layer": 3,
    "acs_type": "ribbon",
    "stay_on_start": true,
    "dlg_desc": "transgender-pride-themed ribbon",
    "dlg_plural": false,
    "ex_props": {
        "transexualpride": true,
        "ribbon-multicolor": true
    },
    "select_info": {
        "display_name": "Ribbon (Transgender Pride Themed)",
        "thumb": "anonymioo_ribbon_transexualpride",
        "group": "ribbon"
    },
    "giftname": "transgenderpridethemedribbon"
}
