{
    "__author": "retroadamshow",
    "version": 3,
    "type": 0,
    "name": "retro_bow_emerald",
    "img_sit": "retro_ribbon_emerald",
    "pose_map": {
        "default": "0",
        "l_default": "5"
    },
    "rec_layer": 3,
    "acs_type": "ribbon",
    "mux_type": [
        "ribbon"
    ],
    "stay_on_start": true,
    "giftname": "8emeraldribbon",
    "dlg_desc": "8-bit emerald ribbon",
    "dlg_plural": false,
    "select_info": {
        "display_name": "Ribbon (8-bit Emerald)",
        "thumb": "retro_ribbon_emerald",
        "group": "ribbon",
        "select_dlg": [
            "How nostalgic!"
        ]
    }
}
